{
  "schemaVersion": "1.0.0",
  "release": "1.0",
  "updatedAt": "2026-09-05T10:25:00.000Z",
  "dataClassification": "REAL_JIRA_DATA",
  "indexes": {
    "byJiraStoryId": {
      "ETA-351": [
        {
          "capability": "account-access",
          "rtmPath": "traceability/capabilities/account-access.rtm.json",
          "traceIds": [
            "TRC-ETA-351-001",
            "TRC-ETA-351-002",
            "TRC-ETA-351-003",
            "TRC-ETA-351-004",
            "TRC-ETA-351-005",
            "TRC-ETA-351-006",
            "TRC-ETA-351-007",
            "TRC-ETA-351-008"
          ]
        }
      ],
      "ETA-411": [
        {
          "capability": "home-navigation",
          "rtmPath": "traceability/capabilities/home-navigation.rtm.json",
          "traceIds": [
            "TRC-ETA-411-001",
            "TRC-ETA-411-002",
            "TRC-ETA-411-003",
            "TRC-ETA-411-004",
            "TRC-ETA-411-005",
            "TRC-ETA-411-006",
            "TRC-ETA-411-007",
            "TRC-ETA-411-008",
            "TRC-ETA-411-009",
            "TRC-ETA-411-010"
          ]
        }
      ]
    },
    "byRequirementId": {
      "REQ-ETA-351-001": [
        {
          "capability": "account-access",
          "rtmPath": "traceability/capabilities/account-access.rtm.json",
          "traceIds": [
            "TRC-ETA-351-001"
          ]
        }
      ],
      "REQ-ETA-351-002": [
        {
          "capability": "account-access",
          "rtmPath": "traceability/capabilities/account-access.rtm.json",
          "traceIds": [
            "TRC-ETA-351-002"
          ]
        }
      ],
      "REQ-ETA-351-003": [
        {
          "capability": "account-access",
          "rtmPath": "traceability/capabilities/account-access.rtm.json",
          "traceIds": [
            "TRC-ETA-351-003"
          ]
        }
      ],
      "REQ-ETA-351-006": [
        {
          "capability": "account-access",
          "rtmPath": "traceability/capabilities/account-access.rtm.json",
          "traceIds": [
            "TRC-ETA-351-004"
          ]
        }
      ],
      "REQ-ETA-351-005": [
        {
          "capability": "account-access",
          "rtmPath": "traceability/capabilities/account-access.rtm.json",
          "traceIds": [
            "TRC-ETA-351-005"
          ]
        }
      ],
      "REQ-ETA-351-007": [
        {
          "capability": "account-access",
          "rtmPath": "traceability/capabilities/account-access.rtm.json",
          "traceIds": [
            "TRC-ETA-351-006",
            "TRC-ETA-351-007"
          ]
        }
      ],
      "REQ-ETA-351-008": [
        {
          "capability": "account-access",
          "rtmPath": "traceability/capabilities/account-access.rtm.json",
          "traceIds": [
            "TRC-ETA-351-008"
          ]
        }
      ],
      "REQ-ETA-411-001": [
        {
          "capability": "home-navigation",
          "rtmPath": "traceability/capabilities/home-navigation.rtm.json",
          "traceIds": [
            "TRC-ETA-411-001",
            "TRC-ETA-411-002"
          ]
        }
      ],
      "REQ-ETA-411-002": [
        {
          "capability": "home-navigation",
          "rtmPath": "traceability/capabilities/home-navigation.rtm.json",
          "traceIds": [
            "TRC-ETA-411-003"
          ]
        }
      ],
      "REQ-ETA-411-003": [
        {
          "capability": "home-navigation",
          "rtmPath": "traceability/capabilities/home-navigation.rtm.json",
          "traceIds": [
            "TRC-ETA-411-004",
            "TRC-ETA-411-005"
          ]
        }
      ],
      "REQ-ETA-411-004": [
        {
          "capability": "home-navigation",
          "rtmPath": "traceability/capabilities/home-navigation.rtm.json",
          "traceIds": [
            "TRC-ETA-411-006"
          ]
        }
      ],
      "REQ-ETA-411-005": [
        {
          "capability": "home-navigation",
          "rtmPath": "traceability/capabilities/home-navigation.rtm.json",
          "traceIds": [
            "TRC-ETA-411-007"
          ]
        }
      ],
      "REQ-ETA-411-006": [
        {
          "capability": "home-navigation",
          "rtmPath": "traceability/capabilities/home-navigation.rtm.json",
          "traceIds": [
            "TRC-ETA-411-008"
          ]
        }
      ],
      "REQ-ETA-411-007": [
        {
          "capability": "home-navigation",
          "rtmPath": "traceability/capabilities/home-navigation.rtm.json",
          "traceIds": [
            "TRC-ETA-411-009",
            "TRC-ETA-411-010"
          ]
        }
      ]
    },
    "byAcId": {
      "AC-ETA-351-001": [
        {
          "capability": "account-access",
          "rtmPath": "traceability/capabilities/account-access.rtm.json",
          "traceIds": [
            "TRC-ETA-351-001"
          ]
        }
      ],
      "AC-ETA-351-002": [
        {
          "capability": "account-access",
          "rtmPath": "traceability/capabilities/account-access.rtm.json",
          "traceIds": [
            "TRC-ETA-351-002"
          ]
        }
      ],
      "AC-ETA-351-003": [
        {
          "capability": "account-access",
          "rtmPath": "traceability/capabilities/account-access.rtm.json",
          "traceIds": [
            "TRC-ETA-351-003"
          ]
        }
      ],
      "AC-ETA-351-004": [
        {
          "capability": "account-access",
          "rtmPath": "traceability/capabilities/account-access.rtm.json",
          "traceIds": [
            "TRC-ETA-351-004"
          ]
        }
      ],
      "AC-ETA-351-005": [
        {
          "capability": "account-access",
          "rtmPath": "traceability/capabilities/account-access.rtm.json",
          "traceIds": [
            "TRC-ETA-351-005"
          ]
        }
      ],
      "AC-ETA-351-006": [
        {
          "capability": "account-access",
          "rtmPath": "traceability/capabilities/account-access.rtm.json",
          "traceIds": [
            "TRC-ETA-351-006"
          ]
        }
      ],
      "AC-ETA-351-007": [
        {
          "capability": "account-access",
          "rtmPath": "traceability/capabilities/account-access.rtm.json",
          "traceIds": [
            "TRC-ETA-351-007"
          ]
        }
      ],
      "AC-ETA-351-008": [
        {
          "capability": "account-access",
          "rtmPath": "traceability/capabilities/account-access.rtm.json",
          "traceIds": [
            "TRC-ETA-351-008"
          ]
        }
      ],
      "AC-ETA-411-001": [
        {
          "capability": "home-navigation",
          "rtmPath": "traceability/capabilities/home-navigation.rtm.json",
          "traceIds": [
            "TRC-ETA-411-001"
          ]
        }
      ],
      "AC-ETA-411-002": [
        {
          "capability": "home-navigation",
          "rtmPath": "traceability/capabilities/home-navigation.rtm.json",
          "traceIds": [
            "TRC-ETA-411-002"
          ]
        }
      ],
      "AC-ETA-411-003": [
        {
          "capability": "home-navigation",
          "rtmPath": "traceability/capabilities/home-navigation.rtm.json",
          "traceIds": [
            "TRC-ETA-411-003"
          ]
        }
      ],
      "AC-ETA-411-004": [
        {
          "capability": "home-navigation",
          "rtmPath": "traceability/capabilities/home-navigation.rtm.json",
          "traceIds": [
            "TRC-ETA-411-004"
          ]
        }
      ],
      "AC-ETA-411-005": [
        {
          "capability": "home-navigation",
          "rtmPath": "traceability/capabilities/home-navigation.rtm.json",
          "traceIds": [
            "TRC-ETA-411-005"
          ]
        }
      ],
      "AC-ETA-411-006": [
        {
          "capability": "home-navigation",
          "rtmPath": "traceability/capabilities/home-navigation.rtm.json",
          "traceIds": [
            "TRC-ETA-411-006"
          ]
        }
      ],
      "AC-ETA-411-007": [
        {
          "capability": "home-navigation",
          "rtmPath": "traceability/capabilities/home-navigation.rtm.json",
          "traceIds": [
            "TRC-ETA-411-007"
          ]
        }
      ],
      "AC-ETA-411-008": [
        {
          "capability": "home-navigation",
          "rtmPath": "traceability/capabilities/home-navigation.rtm.json",
          "traceIds": [
            "TRC-ETA-411-008"
          ]
        }
      ],
      "AC-ETA-411-009": [
        {
          "capability": "home-navigation",
          "rtmPath": "traceability/capabilities/home-navigation.rtm.json",
          "traceIds": [
            "TRC-ETA-411-009"
          ]
        }
      ],
      "AC-ETA-411-010": [
        {
          "capability": "home-navigation",
          "rtmPath": "traceability/capabilities/home-navigation.rtm.json",
          "traceIds": [
            "TRC-ETA-411-010"
          ]
        }
      ]
    },
    "byTestPlanId": {
      "TP-ETA-351-001": [
        {
          "capability": "account-access",
          "rtmPath": "traceability/capabilities/account-access.rtm.json",
          "traceIds": [
            "TRC-ETA-351-001",
            "TRC-ETA-351-002",
            "TRC-ETA-351-003",
            "TRC-ETA-351-004",
            "TRC-ETA-351-005",
            "TRC-ETA-351-006",
            "TRC-ETA-351-007",
            "TRC-ETA-351-008"
          ]
        }
      ],
      "TP-ETA-411-001": [
        {
          "capability": "home-navigation",
          "rtmPath": "traceability/capabilities/home-navigation.rtm.json",
          "traceIds": [
            "TRC-ETA-411-001",
            "TRC-ETA-411-003",
            "TRC-ETA-411-004",
            "TRC-ETA-411-005",
            "TRC-ETA-411-006",
            "TRC-ETA-411-007",
            "TRC-ETA-411-009"
          ]
        }
      ]
    },
    "byTestScenarioId": {
      "TS-ETA-351-001": [
        {
          "capability": "account-access",